{
  "assetId": "JR-VEH-TAXI-001",
  "assetName": "Stylised South African Minibus Taxi",
  "assetCategory": "Vehicle",
  "description": "Mobile-ready, recognisably South African minibus taxi obstacle with a bold Jozi Runner silhouette and no logos.",
  "intendedDistrict": "Johannesburg CBD and Soweto",
  "targetDimensionsMetres": {
    "width": 1.9,
    "height": 2.1,
    "depth": 4.8
  },
  "targetTriangleCount": 10000,
  "maximumTriangleCount": 15000,
  "textureResolution": 1024,
  "requiredMaterials": ["Paint", "Windows", "Tyres", "Lights"],
  "colliderType": "Box",
  "movingPartsRequired": false,
  "lodsRequired": true,
  "spawnRole": "Lane obstacle",
  "gameplayCameraVisibilityRequirements": "Readable from the elevated rear gameplay camera at 8–35 metres; strong roof, rear, and side silhouette.",
  "referenceImagePaths": ["Documentation/References/Taxi/front.jpg", "Documentation/References/Taxi/rear-three-quarter.jpg"],
  "meshyGenerationPrompt": "Stylised game-ready South African minibus taxi, Johannesburg street character, clean bold proportions, white body with restrained colourful geometric accents, no brands or text, mobile endless-runner asset, watertight mesh, wheels as clearly separated named objects, forward axis +Z, up axis +Y, grounded pivot, four material groups maximum, 10k triangle target, neutral pose and lighting.",
  "status": "Pending",
  "approvalState": "Unreviewed",
  "reviewNotes": ""
}
